<?xml version="1.0" encoding="ISO-8859-1"?>
	<!ELEMENT pXw4Pa (group)>
	<!ATTLIST pXw4Pa version CDATA "">
	<!ELEMENT group (group*,entry*)+>
	<!ATTLIST group name CDATA "">
	<!ELEMENT entry (#PCDATA)>
	<!ATTLIST entry
		name CDATA ""
		type (boolean|integer|double|string|NULL) "string">

<!--
THIS DTD FILE IS PART OF THE PXW4PA SOFTWARE
AND IT IS RELEASED UNDER THE TERMS OF THE SAME
CC GNU GPL v.2 LICENSE

pXw4Pa - POOR XML WRAPPER FOR PHP ARRAYS v 1.0
Copyright (C) 2005/2006 yayo (Roberto Correzzola)

This program is free software; you can redistribute it and/or modify it
under the terms of the GNU General Public License as published by
the Free Software Foundation; either version 2 of the License,
or (at your option) any later version.

This program is distributed in the hope that it will be useful,
but WITHOUT ANY WARRANTY; without even the implied warranty
of MERCHANTABILITY or FITNESS FOR A PARTICULAR PURPOSE.
See the GNU General Public License for more details.

You should have received a copy of the GNU General Public License
along with this program; if not, write to the
Free Software Foundation, Inc., 675 Mass Ave, Cambridge, MA 02139, USA.
-->